[
  {
    "assistance_needs": [
      {
        "category": "housing",
        "urgency": "immediate"
      },
      {
        "category": "food",
        "urgency": "immediate"
      }
    ],
    "household": {
      "total_members": 3,
      "composition": {
        "adults": 1,
        "children_under_18": 2,
        "seniors_over_65": 0
      },
      "housing_status": "at_risk"
    },
    "income_sources": [
      "employment",
      "snap"
    ],
    "risk_factors": [
      {
        "type": "eviction_risk",
        "timeframe": "imminent"
      },
      {
        "type": "food_insecurity",
        "timeframe": "current"
      }
    ]
  },
  {
    "assistance_needs": [
      {
        "category": "healthcare",
        "urgency": "ongoing"
      },
      {
        "category": "transportation",
        "urgency": "ongoing"
      }
    ],
    "household": {
      "total_members": 1,
      "composition": {
        "adults": 1,
        "children_under_18": 0,
        "seniors_over_65": 1
      },
      "housing_status": "stable"
    },
    "income_sources": [],
    "risk_factors": [
      {
        "type": "isolation",
        "timeframe": "current"
      },
      {
        "type": "transport_barrier",
        "timeframe": "current"
      }
    ]
  },
  {
    "assistance_needs": [],
    "household": {
      "total_members": 7,
      "composition": {
        "adults": 4,
        "children_under_18": 2,
        "seniors_over_65": 1
      },
      "housing_status": "stable"
    },
    "income_sources": [
      "employment",
      "social_security",
      "pension",
      "snap"
    ],
    "risk_factors": []
  },
  {
    "assistance_needs": [
      {
        "category": "housing",
        "urgency": "immediate"
      },
      {
        "category": "mental_health",
        "urgency": "immediate"
      },
      {
        "category": "substance_treatment",
        "urgency": "immediate"
      }
    ],
    "household": {
      "total_members": 1,
      "composition": {
        "adults": 1,
        "children_under_18": 0,
        "seniors_over_65": 0
      },
      "housing_status": "homeless"
    },
    "income_sources": [],
    "risk_factors": [
      {
        "type": "isolation",
        "timeframe": "current"
      },
      {
        "type": "food_insecurity",
        "timeframe": "potential"
      }
    ]
  },
  {
    "assistance_needs": [
      {
        "category": "childcare",
        "urgency": "short_term"
      },
      {
        "category": "healthcare",
        "urgency": "ongoing"
      }
    ],
    "household": {
      "total_members": 4,
      "composition": {
        "adults": 2,
        "children_under_18": 2,
        "seniors_over_65": 0
      },
      "housing_status": "stable"
    },
    "income_sources": [
      "employment"
    ],
    "risk_factors": []
  },
  {
    "assistance_needs": [
      {
        "category": "housing",
        "urgency": "immediate"
      },
      {
        "category": "legal",
        "urgency": "immediate"
      }
    ],
    "household": {
      "total_members": 1,
      "composition": {
        "adults": 1,
        "children_under_18": 0,
        "seniors_over_65": 0
      },
      "housing_status": "at_risk"
    },
    "income_sources": [],
    "risk_factors": [
      {
        "type": "domestic_violence",
        "timeframe": "current"
      }
    ]
  },
  {
    "assistance_needs": [
      {
        "category": "healthcare",
        "urgency": "ongoing"
      },
      {
        "category": "transportation",
        "urgency": "ongoing"
      },
      {
        "category": "childcare",
        "urgency": "ongoing"
      }
    ],
    "household": {
      "total_members": 4,
      "composition": {
        "adults": 2,
        "children_under_18": 2,
        "seniors_over_65": 0
      },
      "housing_status": "stable"
    },
    "income_sources": [
      "disability",
      "snap"
    ],
    "risk_factors": []
  },
  {
    "assistance_needs": [
      {
        "category": "healthcare",
        "urgency": "immediate"
      }
    ],
    "household": {
      "total_members": 2,
      "composition": {
        "adults": 2,
        "children_under_18": 0,
        "seniors_over_65": 2
      },
      "housing_status": "stable"
    },
    "income_sources": [],
    "risk_factors": [
      {
        "type": "medical_crisis",
        "timeframe": "current"
      },
      {
        "type": "isolation",
        "timeframe": "current"
      }
    ]
  },
  {
    "assistance_needs": [
      {
        "category": "housing",
        "urgency": "immediate"
      },
      {
        "category": "employment",
        "urgency": "short_term"
      },
      {
        "category": "education",
        "urgency": "ongoing"
      }
    ],
    "household": {
      "total_members": 1,
      "composition": {
        "adults": 1,
        "children_under_18": 0,
        "seniors_over_65": 0
      },
      "housing_status": "temporary"
    },
    "income_sources": [
      "none"
    ],
    "risk_factors": []
  },
  {
    "assistance_needs": [
      {
        "category": "substance_treatment",
        "urgency": "immediate"
      },
      {
        "category": "childcare",
        "urgency": "immediate"
      }
    ],
    "household": {
      "total_members": 3,
      "composition": {
        "adults": 1,
        "children_under_18": 2,
        "seniors_over_65": 0
      },
      "housing_status": "unstable"
    },
    "income_sources": [
      "tanf",
      "snap"
    ],
    "risk_factors": [
      {
        "type": "substance_use",
        "timeframe": "ongoing"
      },
      {
        "type": "food_insecurity",
        "timeframe": "current"
      }
    ]
  },
  {
    "assistance_needs": [
      {
        "category": "housing",
        "urgency": "immediate"
      },
      {
        "category": "healthcare",
        "urgency": "ongoing"
      },
      {
        "category": "mental_health",
        "urgency": "ongoing"
      }
    ],
    "household": {
      "total_members": 1,
      "composition": {
        "adults": 1,
        "children_under_18": 0,
        "seniors_over_65": 0
      },
      "housing_status": "homeless"
    },
    "income_sources": [
      "none"
    ],
    "risk_factors": []
  },
  {
    "assistance_needs": [
      {
        "category": "childcare",
        "urgency": "ongoing"
      },
      {
        "category": "legal",
        "urgency": "short_term"
      }
    ],
    "household": {
      "total_members": 3,
      "composition": {
        "adults": 1,
        "children_under_18": 2,
        "seniors_over_65": 0
      },
      "housing_status": "stable"
    },
    "income_sources": [
      "employment",
      "child_support"
    ],
    "risk_factors": []
  },
  {
    "assistance_needs": [
      {
        "category": "healthcare",
        "urgency": "immediate"
      }
    ],
    "household": {
      "total_members": 2,
      "composition": {
        "adults": 1,
        "children_under_18": 0,
        "seniors_over_65": 1
      },
      "housing_status": "stable"
    },
    "income_sources": [],
    "risk_factors": [
      {
        "type": "medical_crisis",
        "timeframe": "current"
      }
    ]
  },
  {
    "assistance_needs": [
      {
        "category": "food",
        "urgency": "ongoing"
      },
      {
        "category": "employment",
        "urgency": "short_term"
      }
    ],
    "household": {
      "total_members": 5,
      "composition": {
        "adults": 2,
        "children_under_18": 3,
        "seniors_over_65": 0
      },
      "housing_status": "stable"
    },
    "income_sources": [
      "snap",
      "tanf"
    ],
    "risk_factors": []
  }
]